No,Nama,LLDikti,
1,AKADEMI ADMINISTRASI RUMAH SAKIT MATARAM,8,
2,Akademi Akuntansi (AKTAN) Boekittinggi,10,
3,Akademi Akuntansi Bandung,4,
4,Akademi Akuntansi Bina Insani,4,
5,Akademi Akuntansi Borobudur,3,
6,Akademi Akuntansi Dan Komputer Stephen Jambi,10,
7,Akademi Akuntansi Dan Manajemen Mitra Lampung,2,
8,Akademi Akuntansi Dan Manajemen Pembangunan,10,
9,Akademi Akuntansi Denpasar,8,
10,Akademi Akuntansi Effendi Harahap,6,
11,Akademi Akuntansi Indonesia Padang,10,
12,Akademi Akuntansi Jayabaya,3,
13,Akademi Akuntansi Keuangan Dan Perbankan Indonesia,4,
14,Akademi Akuntansi Lampung,2,
15,Akademi Akuntansi Muhammadiyah Klaten,6,
16,Akademi Akuntansi Permata Harapan Batam,10,
17,Akademi Akuntansi PGRI Jember,7,
18,Akademi Akuntansi Riau,10,
19,Akademi Akuntansi YAI Jakarta,3,
20,Akademi Akuntansi YKPN,5,
21,Akademi Akuntansi YPK Medan,1,
22,AKADEMI AKUPUNKTUR SURABAYA,,
23,AKADEMI ANALIS FARMASI AL-ISLAM,,
24,AKADEMI ANALIS FARMASI DAN MAKANAN BANDA ACEH,,
25,AKADEMI ANALIS FARMASI DAN MAKANAN PUTRA INDONESIA,,
26,AKADEMI ANALIS FARMASI DAN MAKANAN SUNAN GIRI PONOROGO,7,
27,AKADEMI ANALIS KESEHATAN 17 AGUSTUS 1945 SEMARANG,,
28,AKADEMI ANALIS KESEHATAN AN NASHER,,
29,AKADEMI ANALIS KESEHATAN DELIMA HUSADA GRESIK,,
30,AKADEMI ANALIS KESEHATAN HARAPAN BANGSA,2,
31,AKADEMI ANALIS KESEHATAN MALANG,,
32,AKADEMI ANALIS KESEHATAN MANGGALA YOGYAKARTA,5,
33,AKADEMI ANALIS KESEHATAN MUHAMMADIYAH MAKASSAR,,
34,AKADEMI ANALIS KESEHATAN PEKALONGAN,,
35,AKADEMI ANALIS KESEHATAN PEKANBARU,,
36,AKADEMI ANALIS KESEHATAN PUTRA JAYA BATAM,,
37,AKADEMI ANALIS KESEHATAN WIDYA DHARMA,,
38,Akademi Angkatan Laut Surabaya,,
39,Akademi Angkatan Udara (AAU),,
40,AKADEMI AUDIOLOGI INDONESIA,,
41,Akademi Bahasa Asing Balikpapan,11,
42,Akademi Bahasa Asing Bina Insan Indonesia,2,
43,Akademi Bahasa Asing Colorado Samarinda,11,
44,Akademi Bahasa Asing Dian Cipta Cendikia,2,
45,Akademi Bahasa Asing Harapan Bangsa,6,
46,Akademi Bahasa Asing Internasional Bandung,4,
47,Akademi Bahasa Asing Permata Harapan,10,
48,Akademi Bahasa Asing Permata Hati Tarakan,11,
49,Akademi Bahasa Asing Persada Bunda,10,
50,Akademi Bahasa Asing Sinema Yogyakarta,5,
51,Akademi Bahasa Asing St Pignatelli,6,
52,Akademi Bahasa Asing UMI Makassar,9,
53,Akademi Bahasa Asing Widya Dharma,11,
54,AKADEMI BAKTI KEMANUSIAAN PALANG MERAH INDONESIA,,
55,Akademi Enterpreneurship Terang Bangsa,6,
56,AKADEMI FARMASI  YARSI  PONTIANAK,,
57,AKADEMI FARMASI AL-ISHLAH CILEGON,,
58,AKADEMI FARMASI BHUMI HUSADA,,
59,AKADEMI FARMASI BINA FARMASI,,
60,AKADEMI FARMASI BUMI SILIWANGI,,
61,AKADEMI FARMASI DWI FARMA,,
62,AKADEMI FARMASI IMAM BONJOL,,
63,AKADEMI FARMASI INDAH DELI SERDANG,,
64,AKADEMI FARMASI INDONESIA YOGYAKARTA,,
65,AKADEMI FARMASI INSTITUT KEJURUAN ILMU FARMASI,3,
66,AKADEMI FARMASI ISFI BANJARMASIN,11,
67,AKADEMI FARMASI JEMBER,,
68,AKADEMI FARMASI KALTARA TARAKAN,,
69,AKADEMI FARMASI KEBANGSAAN MAKASSAR,,
70,AKADEMI FARMASI KUSUMA HUSADA PURWOKERTO,,
71,AKADEMI FARMASI MAHADHIKA,,
72,AKADEMI FARMASI MITRA SEHAT MANDIRI SIDOARJO,,
73,AKADEMI FARMASI MUHAMMADIYAH CIREBON,4,
74,AKADEMI FARMASI MUHAMMADIYAH KABUPATEN KUNINGAN,,
75,AKADEMI FARMASI NUSAPUTERA,,
76,AKADEMI FARMASI PRAYOGA PADANG,,
77,AKADEMI FARMASI PUTRA INDONESIA MALANG,,
78,AKADEMI FARMASI RANAH MINANG,,
79,AKADEMI FARMASI SANDI KARSA,9,
80,AKADEMI FARMASI SANTO FRANSISKUS XAVERIUS,,
81,AKADEMI FARMASI SARASWATI DENPASAR,8,
82,AKADEMI FARMASI SURABAYA,,
83,AKADEMI FARMASI TADULAKO FARMA,,
84,AKADEMI FARMASI THERESIANA,6,
85,AKADEMI FARMASI TORAJA,,
86,AKADEMI FARMASI YAMASI MAKASSAR,,
87,AKADEMI FARMASI YAYASAN AL-FATAH,,
88,AKADEMI FARMASI YAYASAN TENAGA PEMBANGUNAN ARJUNA LAGUBOTI,,
89,AKADEMI FARMASI YPF,,
90,AKADEMI FARMASI YPPM MANDIRI,,
91,AKADEMI FISIOTERAPI HARAPAN BANGSA BANDA ACEH,,
92,AKADEMI FISIOTERAPI MUHAMMADIYAH ACEH,,
93,AKADEMI FISIOTERAPI RUMAH SAKIT DUSTIRA,,
94,AKADEMI FISIOTERAPI WIDYA HUSADA,6,
95,AKADEMI FISIOTERAPI YAB YOGYAKARTA,5,
96,AKADEMI GIZI ANDALUSIA,,
97,Akademi Gizi Karya Husada Kediri,7,
98,AKADEMI ILMU GIZI YPAG MAKASSAR,,
99,Akademi Ilmu Komputer Ternate,12,
100,Akademi Ilmu Pelayaran Nusa Tenggara,8,
101,Akademi Industri Tekstil Bandung,4,
102,Akademi Informatika Dan Komputer Medicom,1,
103,AKADEMI KEBIDANAN ABDI PERSADA,,
104,AKADEMI KEBIDANAN ABDURAHMAN,,
105,AKADEMI KEBIDANAN ADILA,2,
106,AKADEMI KEBIDANAN AGATHA,1,
107,AKADEMI KEBIDANAN AGUNG HUSADA,,
108,AKADEMI KEBIDANAN AIFA HUSADA BANGKALAN,,
109,AKADEMI KEBIDANAN AISYAH KABUPATEN PANGKEP,,
110,AKADEMI KEBIDANAN AISYIYAH PONTIANAK,11,
111,AKADEMI KEBIDANAN AL-FATHONAH JAKARTA,3,
112,AKADEMI KEBIDANAN ALIFA PRINGSEWU LAMPUNG,,
113,AKADEMI KEBIDANAN ALIFAH PADANG,,
114,AKADEMI KEBIDANAN AL-IKHLAS CISARUA,,
115,AKADEMI KEBIDANAN AL-ISHLAH CILEGON,4,
116,AKADEMI KEBIDANAN AL-SUA'IBAH PALEMBANG,,
117,AKADEMI KEBIDANAN AMANAH MUARA BUNGO,,
118,AKADEMI KEBIDANAN ANNISA JAYA,,
119,AKADEMI KEBIDANAN AN-NUR HUSADA WALISONGO,,
120,AKADEMI KEBIDANAN AN-NUR PURWODADI,6,
121,AKADEMI KEBIDANAN ANUGERAH BINTAN,10,
122,AKADEMI KEBIDANAN AR-RAHMA,7,
123,AKADEMI KEBIDANAN AR-RAHMAH BANDUNG,,
124,AKADEMI KEBIDANAN AR-RUM SALATIGA,6,
125,AKADEMI KEBIDANAN ARTA KABANJAHE,,
126,AKADEMI KEBIDANAN AS SYIFA,,
127,AKADEMI KEBIDANAN ASSYIFA TANGERANG,,
128,AKADEMI KEBIDANAN AUDI HUSADA MEDAN,1,
129,AKADEMI KEBIDANAN BAKTI INDONESIA BALIKPAPAN,,
130,AKADEMI KEBIDANAN BAKTI INDONESIA BOGOR,,
131,AKADEMI KEBIDANAN BALI WISNU DHARMA DENPASAR,,
132,AKADEMI KEBIDANAN BANDUNG,4,
133,AKADEMI KEBIDANAN BANJARBARU,,
134,AKADEMI KEBIDANAN BANUA BINA HUSADA,,
135,AKADEMI KEBIDANAN BARUNA HUSADA SIBUHUAN,1,
136,AKADEMI KEBIDANAN BATARI TOJA,,
137,AKADEMI KEBIDANAN BERLIAN NUSANTARA,,
138,AKADEMI KEBIDANAN BETANG ASI RAYA,,
139,AKADEMI KEBIDANAN BHAKTI ASIH,,
140,AKADEMI KEBIDANAN BHAKTI BANGSA,,
141,AKADEMI KEBIDANAN BHAKTI HUSADA CIKARANG,4,
142,AKADEMI KEBIDANAN BHAKTI NUGRAHA,,
143,AKADEMI KEBIDANAN BHAKTI NUSANTARA SALATIGA,,
144,AKADEMI KEBIDANAN BHAKTI PERTIWI PEMALANG,,
145,AKADEMI KEBIDANAN BHAKTI PURNA HUSADA,4,
146,AKADEMI KEBIDANAN BHAKTI PUTRA BANGSA PURWOREJO,6,
147,AKADEMI KEBIDANAN BINA DAYA HUSADA,,
148,AKADEMI KEBIDANAN BINA HUSADA,,
149,AKADEMI KEBIDANAN BINA HUSADA TANGERANG,,
150,AKADEMI KEBIDANAN BINA SEHAT NUSANTARA,,
151,AKADEMI KEBIDANAN BORNEO MEDISTRA,,
152,AKADEMI KEBIDANAN BUDI MULIA,10,
153,AKADEMI KEBIDANAN BUDI MULIA,,
154,AKADEMI KEBIDANAN BUNDA AUNI,,
155,AKADEMI KEBIDANAN BUNDA KOTAMOBAGU,,
156,AKADEMI KEBIDANAN BUNGA BANGSA IDI,,
157,AKADEMI KEBIDANAN BUNGA BANGSAKU BANGKA,,
158,AKADEMI KEBIDANAN BUNGA HUSADA,,
159,AKADEMI KEBIDANAN BUNGA KALIMANTAN,,
160,AKADEMI KEBIDANAN BUTON RAYA,9,
161,AKADEMI KEBIDANAN CIANJUR,4,
162,AKADEMI KEBIDANAN DARMAIS PADANGSIDIMPUAN,,
163,AKADEMI KEBIDANAN DARMO MEDAN,1,
164,AKADEMI KEBIDANAN DARUL HUSADA,,
165,AKADEMI KEBIDANAN DARUSSALAM,13,
166,AKADEMI KEBIDANAN DEHASEN BENGKULU,2,
167,AKADEMI KEBIDANAN DELI HUSADA DELITUA MEDAN,1,
168,AKADEMI KEBIDANAN DELIMA,,
169,AKADEMI KEBIDANAN DHARMA HUSADA KEDIRI,7,
170,AKADEMI KEBIDANAN DHARMA HUSADA PEKANBARU,,
171,AKADEMI KEBIDANAN DHARMA PRAJA BONDOWOSO,,
172,AKADEMI KEBIDANAN DUTA DHARMA PATI,,
173,AKADEMI KEBIDANAN FARAMA MULYA,,
174,AKADEMI KEBIDANAN GATRA BUANA GURABATI TIDORE,,
175,AKADEMI KEBIDANAN GEMA NUSANTARA BEKASI,,
176,AKADEMI KEBIDANAN GEMILANG HUSADA KOTABUMI,2,
177,AKADEMI KEBIDANAN GRAHA ANANDA,,
178,AKADEMI KEBIDANAN GRAHA HUSADA SAMPANG,,
179,AKADEMI KEBIDANAN GRAHA MANDIRI CILACAP,6,
180,AKADEMI KEBIDANAN GRIYA HUSADA,7,
181,AKADEMI KEBIDANAN HAFSYAH MEDAN,,
182,AKADEMI KEBIDANAN HAJI AMIRULLAH,,
183,AKADEMI KEBIDANAN HAMPAR BAIDURI,,
184,AKADEMI KEBIDANAN HANG JEBAT,,
185,AKADEMI KEBIDANAN HARAPAN BUNDA,8,
186,AKADEMI KEBIDANAN HARAPAN IBU LANGSA,,
187,AKADEMI KEBIDANAN HARAPAN IBU PEKALONGAN,,
188,AKADEMI KEBIDANAN HARAPAN KELUARGA,1,
189,AKADEMI KEBIDANAN HARAPAN MAMA DELI SERDANG,,
190,AKADEMI KEBIDANAN HARAPAN MULYA PONOROGO,7,
191,AKADEMI KEBIDANAN HELVETIA MEDAN,1,
192,AKADEMI KEBIDANAN HEPPY ZAL PALEMBANG,,
193,AKADEMI KEBIDANAN HISARMA MEDAN,,
194,AKADEMI KEBIDANAN HUSADA GEMILANG,10,
195,AKADEMI KEBIDANAN IBRAHIMY,7,
196,AKADEMI KEBIDANAN IBTISAM AULIA,,
197,AKADEMI KEBIDANAN IKA BINA LABUHAN BATU,1,
198,AKADEMI KEBIDANAN IMAM BONJOL,10,
199,AKADEMI KEBIDANAN INDRAGIRI,,
200,AKADEMI KEBIDANAN INTERNASIONAL PEKANBARU,10,
201,AKADEMI KEBIDANAN JEMBER,,
202,AKADEMI KEBIDANAN KAMANRE PALOPO,9,
203,AKADEMI KEBIDANAN KARTIKA MITRA HUSADA,,
204,AKADEMI KEBIDANAN KARTINI JAKARTA,,
205,AKADEMI KEBIDANAN KARYA BUNDA HUSADA,4,
206,AKADEMI KEBIDANAN KELUARGA BUNDA JAMBI,,
207,AKADEMI KEBIDANAN KERIS HUSADA,3,
208,AKADEMI KEBIDANAN KH PUTRA,,
209,AKADEMI KEBIDANAN KHARISMA HUSADA BINJAI,,
210,AKADEMI KEBIDANAN KHOLISATUR RAHMI,,
211,AKADEMI KEBIDANAN KUDUS,,
212,AKADEMI KEBIDANAN KUTAI HUSADA,,
213,AKADEMI KEBIDANAN LA TANSA MASHIRO,,
214,AKADEMI KEBIDANAN LAKSAMANA,,
215,AKADEMI KEBIDANAN LANGKAT,,
216,AKADEMI KEBIDANAN LAPATAU BONE,9,
217,AKADEMI KEBIDANAN MADINA HUSADA,,
218,AKADEMI KEBIDANAN MAKARIWO,,
219,AKADEMI KEBIDANAN MANDIRI GRESIK,7,
220,AKADEMI KEBIDANAN MANNA,,
221,AKADEMI KEBIDANAN MATORKIS,1,
222,AKADEMI KEBIDANAN MEDICA BAKTI NUSANTARA,,
223,AKADEMI KEBIDANAN MEDICA BAKTI PERSADA,,
224,AKADEMI KEBIDANAN MEDIKA WIYATA KEDIRI,,
225,AKADEMI KEBIDANAN MENARA BUNDA,9,
226,AKADEMI KEBIDANAN MENARA PRIMADANI,,
227,AKADEMI KEBIDANAN MINASA UPA,,
228,AKADEMI KEBIDANAN MITRA HUSADA MEDAN,1,
229,AKADEMI KEBIDANAN MITRA HUSADA PADANG,,
230,AKADEMI KEBIDANAN MITRA SEHAT SIDOARJO,7,
231,AKADEMI KEBIDANAN MITRA SYUHADA PADANGSIDIMPUAN,1,
232,AKADEMI KEBIDANAN MUHAMMADIYAH BANDA ACEH,,
233,AKADEMI KEBIDANAN MUHAMMADIYAH KOTIM,,
234,AKADEMI KEBIDANAN MULIA MADANI YOGYAKARTA,,
235,AKADEMI KEBIDANAN MUNAWARRAH BIREUEN,1,
236,AKADEMI KEBIDANAN MUNAWARRAH BIREUEN,,
237,AKADEMI KEBIDANAN MUSLIMAT NAHDLATUL ULAMA KUDUS,,
238,AKADEMI KEBIDANAN MUTIARA MAHAKAM,11,
239,AKADEMI KEBIDANAN NAMIRA KOTANOPAN,1,
240,AKADEMI KEBIDANAN NURUL HASANAH,,
241,AKADEMI KEBIDANAN NUSANTARA 2000,,
242,AKADEMI KEBIDANAN NUSANTARA INDONESIA LUBUKLINGGAU,,
243,AKADEMI KEBIDANAN NUSANTARA JAYA,9,
244,AKADEMI KEBIDANAN NYAI AHMAD DAHLAN YOGYAKARTA,,
245,AKADEMI KEBIDANAN PALU SULAWESI TENGAH,,
246,AKADEMI KEBIDANAN PALUTA HUSADA,,
247,AKADEMI KEBIDANAN PAMENANG,7,
248,AKADEMI KEBIDANAN PANCA BHAKTI,,
249,AKADEMI KEBIDANAN PANCA BHAKTI PONTIANAK,,
250,AKADEMI KEBIDANAN PANTI WILASA,6,
251,AKADEMI KEBIDANAN PARAMATA RAHA,,
252,AKADEMI KEBIDANAN PASAMAN BARAT,10,
253,AKADEMI KEBIDANAN PATRIOT BANGSA HUSADA LAMPUNG,,
254,AKADEMI KEBIDANAN PAYUNG PELALAWAN,,
255,AKADEMI KEBIDANAN PELITA ILMU,4,
256,AKADEMI KEBIDANAN PEMERINTAH KABUPATEN KARO KABANJAHE,,
257,AKADEMI KEBIDANAN PEMERINTAH PROVINSI BALI SINGARAJA,,
258,AKADEMI KEBIDANAN PEMKAB MUARA ENIM,,
259,AKADEMI KEBIDANAN PERMATA HUSADA SAMARINDA,,
260,AKADEMI KEBIDANAN PERSADA PALEMBANG,,
261,AKADEMI KEBIDANAN PERSADA WAJO,9,
262,AKADEMI KEBIDANAN PETRO MANDAU HUSADA,10,
263,AKADEMI KEBIDANAN PGRI KEDIRI,7,
264,AKADEMI KEBIDANAN PONDOK PESANTREN ASSANADIYAH,,
265,AKADEMI KEBIDANAN PRIMA HUSADA,,
266,AKADEMI KEBIDANAN PRIMA INDONESIA,4,
267,AKADEMI KEBIDANAN PRIMA SENGKANG,9,
268,AKADEMI KEBIDANAN PUBLIC HEALTH MEDICAL NURSING MEULABOH,,
269,AKADEMI KEBIDANAN PUTRA JAYA MANDIRI BATAM,,
270,AKADEMI KEBIDANAN PUTRI BANGSA PARIAMAN,,
271,AKADEMI KEBIDANAN RANGGA HUSADA PRABUMULIH,,
272,AKADEMI KEBIDANAN REFORMASI,,
273,AKADEMI KEBIDANAN RESPATI,4,
274,AKADEMI KEBIDANAN RIZKI PATYA,,
275,AKADEMI KEBIDANAN RSPAD GATOT SOEBROTO,3,
276,AKADEMI KEBIDANAN SALEHA,,
277,AKADEMI KEBIDANAN SALMA,,
278,AKADEMI KEBIDANAN SANDI KARSA,9,
279,AKADEMI KEBIDANAN SARI MUTIARA MEDAN,1,
280,AKADEMI KEBIDANAN SAYID SABIQ INDRAMAYU,,
281,AKADEMI KEBIDANAN SEHAT MEDAN,,
282,AKADEMI KEBIDANAN SEHATI,,
283,AKADEMI KEBIDANAN SEMPENA NEGERI PEKANBARU,,
284,AKADEMI KEBIDANAN SENTRA BINA YUDHISTIRA TANGERANG,,
285,AKADEMI KEBIDANAN SENTRAL,,
286,AKADEMI KEBIDANAN SIFRA HUSADA,,
287,AKADEMI KEBIDANAN SINAR KASIH TORAJA,,
288,AKADEMI KEBIDANAN SINGKAWANG,,
289,AKADEMI KEBIDANAN SISMADI,,
290,AKADEMI KEBIDANAN SITI FATIMAH,6,
291,AKADEMI KEBIDANAN ST. BENEDICTA PONTIANAK,11,
292,AKADEMI KEBIDANAN SUKAWATI LAWANG,,
293,AKADEMI KEBIDANAN SURYA MANDIRI KOTA BIMA,,
294,AKADEMI KEBIDANAN TAHIRAH AL BAETI BULUKUMBA,,
295,AKADEMI KEBIDANAN TARUTUNG PEMKAB TAPANULI UTARA,,
296,AKADEMI KEBIDANAN TIARA BUNDA,,
297,AKADEMI KEBIDANAN TRINITA MANADO,,
298,AKADEMI KEBIDANAN TUNAS HARAPAN BANGSA,,
299,AKADEMI KEBIDANAN UMI BAGAN BATU,,
300,AKADEMI KEBIDANAN UMMI KHASANAH,5,
301,AKADEMI KEBIDANAN WAHANA HUSADA BANDAR JAYA,2,
302,AKADEMI KEBIDANAN WIJAYA HUSADA,4,
303,AKADEMI KEBIDANAN WIRA BUANA METRO,,
304,AKADEMI KEBIDANAN WIRA HUSADA NUSANTARA,7,
305,AKADEMI KEBIDANAN WIYATA MITRA HUSADA NGANJUK,,
306,AKADEMI KEBIDANAN YALEKA MARO MERAUKE,,
307,AKADEMI KEBIDANAN YAPKESBI BANJARBARU,11,
308,AKADEMI KEBIDANAN YAPMA MAKASSAR,,
309,AKADEMI KEBIDANAN YAPPI SRAGEN,6,
310,AKADEMI KEBIDANAN YASPEN TUGU IBU,,
311,AKADEMI KEBIDANAN YAYASAN KESEHATAN NASIONAL,9,
312,AKADEMI KEBIDANAN YAYASAN PENDIDIKAN MONA,13,
313,AKADEMI KEBIDANAN YAYASAN RUMAH SAKIT JAKARTA,,
314,AKADEMI KEBIDANAN YPDR,,
315,AKADEMI KEBIDANAN YPSDMI,,
316,Akademi Kelautan Banyuwangi,7,
317,AKADEMI KEPERAWATAN ABULYATAMA,,
318,AKADEMI KEPERAWATAN AISYIYAH PADANG,10,
319,AKADEMI KEPERAWATAN AL HIKMAH,,
320,AKADEMI KEPERAWATAN AL-IKHLAS CISARUA,,
321,AKADEMI KEPERAWATAN ALKAUTSAR TEMANGGUNG,,
322,AKADEMI KEPERAWATAN AL-MA ARIF,,
323,AKADEMI KEPERAWATAN ANDAKARA,,
324,AKADEMI KEPERAWATAN ANDALUSIA JAKARTA,,
325,AKADEMI KEPERAWATAN ANTARIKSA,,
326,AKADEMI KEPERAWATAN ARTA KABANJAHE,1,
327,Akademi Keperawatan As-Syafi`iyah,3,
328,AKADEMI KEPERAWATAN BAHRUL ULUM JOMBANG,,
329,AKADEMI KEPERAWATAN BAITUL HIKMAH,,
330,AKADEMI KEPERAWATAN BAITURRAHMAH PADANG,10,
331,AKADEMI KEPERAWATAN BALA KESELAMATAN,16,
332,AKADEMI KEPERAWATAN BARAMULI,16,
333,AKADEMI KEPERAWATAN BATARI TOJA,,
334,AKADEMI KEPERAWATAN BERKALA WIDYA HUSADA,,
335,AKADEMI KEPERAWATAN BETHESDA SERUKAM,,
336,AKADEMI KEPERAWATAN BETHESDA TOMOHON,,
337,AKADEMI KEPERAWATAN BHAKTI HUSADA CIKARANG,,
338,AKADEMI KEPERAWATAN BIDARA MUKTI,,
339,AKADEMI KEPERAWATAN BINA HUSADA TEBING TINGGI,,
340,AKADEMI KEPERAWATAN BINA INSAN JAKARTA,3,
341,AKADEMI KEPERAWATAN BINA INSANI SAKTI,10,
342,AKADEMI KEPERAWATAN BINALITA SUDAMA,,
343,AKADEMI KEPERAWATAN BUNDA DELIMA,,
344,AKADEMI KEPERAWATAN BUNTET PESANTREN,4,
345,AKADEMI KEPERAWATAN COLUMBIA ASIA,,
346,AKADEMI KEPERAWATAN DARMO MEDAN,1,
347,AKADEMI KEPERAWATAN DELI HUSADA DELITUA MEDAN,1,
348,AKADEMI KEPERAWATAN DHARMA HUSADA,,
349,AKADEMI KEPERAWATAN DHARMA HUSADA CIREBON,,
350,AKADEMI KEPERAWATAN DHARMA HUSADA PEKANBARU,10,
351,AKADEMI KEPERAWATAN DHARMA INSAN PONTIANAK,,
352,AKADEMI KEPERAWATAN DHARMA WACANA METRO,,
353,AKADEMI KEPERAWATAN DIAN HUSADA,,
354,AKADEMI KEPERAWATAN DR. SOEDONO PROVINSI JAWA TIMUR,,
355,AKADEMI KEPERAWATAN FATIMA PARE-PARE,,
356,AKADEMI KEPERAWATAN FATMAWATI,3,
357,AKADEMI KEPERAWATAN GARUDA PUTIH JAMBI,,
358,AKADEMI KEPERAWATAN GIRI SATRIA HUSADA,,
359,AKADEMI KEPERAWATAN GITA MATURA ABADI KISARAN,1,
360,AKADEMI KEPERAWATAN GUNUNG MARIA,,
361,AKADEMI KEPERAWATAN HANG TUAH JAKARTA,,
362,AKADEMI KEPERAWATAN HARAPAN MAMA DELI SERDANG,,
363,AKADEMI KEPERAWATAN HARUM,3,
364,AKADEMI KEPERAWATAN HELVETIA,,
365,AKADEMI KEPERAWATAN HUSADA KARYA JAYA,3,
366,AKADEMI KEPERAWATAN IBNU SINA KOTA SABANG,13,
367,AKADEMI KEPERAWATAN INSAN HUSADA SURAKARTA,,
368,AKADEMI KEPERAWATAN INTAN MARTAPURA,11,
369,AKADEMI KEPERAWATAN ISLAMIC VILLAGE,,
370,AKADEMI KEPERAWATAN KALTARA TARAKAN,11,
371,AKADEMI KEPERAWATAN KARYA BHAKTI NUSANTARA,6,
372,AKADEMI KEPERAWATAN KERIS HUSADA JAKARTA,,
373,AKADEMI KEPERAWATAN KESDAM I/ BUKIT BARISAN,1,
374,AKADEMI KEPERAWATAN KESDAM I/BUKIT BARISAN,,
375,AKADEMI KEPERAWATAN KESDAM I/BUKIT BARISAN PADANG,10,
376,AKADEMI KEPERAWATAN KESDAM I/BUKIT BARISAN PEMATANG SIANTAR,1,
377,AKADEMI KEPERAWATAN KESDAM II SRIWIJAYA,2,
378,AKADEMI KEPERAWATAN KESDAM ISKANDAR MUDA BANDA ACEH,,
379,AKADEMI KEPERAWATAN KESDAM ISKANDAR MUDA LHOKSEUMAWE,,
380,AKADEMI KEPERAWATAN KESDAM IV/DIPONEGORO,6,
381,AKADEMI KEPERAWATAN KESDAM IX/UDAYANA,8,
382,AKADEMI KEPERAWATAN KESDAM VI/TANJUNGPURA,11,
383,AKADEMI KEPERAWATAN KRIDA HUSADA,,
384,AKADEMI KEPERAWATAN LAPATAU BONE,,
385,AKADEMI KEPERAWATAN MAKASAR,,
386,AKADEMI KEPERAWATAN MALAHAYATI MEDAN,,
387,AKADEMI KEPERAWATAN MANDIRI,,
388,AKADEMI KEPERAWATAN MANGGALA HUSADA,,
389,AKADEMI KEPERAWATAN MAPPA OUDANG MAKASSAR,,
390,AKADEMI KEPERAWATAN MARANATHA GROUPS,15,
391,AKADEMI KEPERAWATAN MUHAMMADIYAH BIREUEN,,
392,AKADEMI KEPERAWATAN NABILA,10,
393,AKADEMI KEPERAWATAN NAZHATUT THULLAB SAMPANG,,
394,AKADEMI KEPERAWATAN NGESTI WALUYO PARAKAN,6,
395,AKADEMI KEPERAWATAN NOTOKUSUMO,5,
396,AKADEMI KEPERAWATAN PANCA BHAKTI,,
397,AKADEMI KEPERAWATAN PANDAN HARUM BANJARMASIN,,
398,AKADEMI KEPERAWATAN PANGKALPINANG,,
399,AKADEMI KEPERAWATAN PANTI KOSALA,,
400,AKADEMI KEPERAWATAN PASAR REBO JAKARTA,,
401,AKADEMI KEPERAWATAN PATRIA HUSADA SURAKARTA,,
402,AKADEMI KEPERAWATAN PELNI,,
403,AKADEMI KEPERAWATAN PEMBINA,,
404,AKADEMI KEPERAWATAN PEMDA WAIKABUBAK,,
405,AKADEMI KEPERAWATAN PEMERINTAH DAERAH KABUPATEN SERANG PROVINSI BANTEN,,
406,AKADEMI KEPERAWATAN PEMERINTAH KABUPATEN ASAHAN KISARAN,,
407,AKADEMI KEPERAWATAN PEMERINTAH KABUPATEN BELITUNG,,
408,AKADEMI KEPERAWATAN PEMERINTAH KABUPATEN BUTON,,
409,AKADEMI KEPERAWATAN PEMERINTAH KABUPATEN DAIRI SIDIKALANG PROVINSI SUMATERA UTARA,,
410,AKADEMI KEPERAWATAN PEMERINTAH KABUPATEN KOTAWARINGIN TIMUR PROVINSI KALIMANTAN TENGAH,,
411,AKADEMI KEPERAWATAN PEMERINTAH KABUPATEN LAMONGAN,,
412,AKADEMI KEPERAWATAN PEMERINTAH KABUPATEN MUNA,,
413,AKADEMI KEPERAWATAN PEMERINTAH KABUPATEN MUSI BANYUASIN,,
414,AKADEMI KEPERAWATAN PEMERINTAH KABUPATEN NGAWI,,
415,AKADEMI KEPERAWATAN PEMERINTAH KABUPATEN PAMEKASAN,,
416,AKADEMI KEPERAWATAN PEMERINTAH KABUPATEN PURWOREJO,,
417,AKADEMI KEPERAWATAN PEMERINTAH KABUPATEN TAPANULI UTARA,,
418,AKADEMI KEPERAWATAN PEMERINTAH KABUPATEN WAJO,,
419,AKADEMI KEPERAWATAN PEMERINTAH PROVINSI KALIMANTAN BARAT,,
420,AKADEMI KEPERAWATAN PEMKOT TEGAL,,
421,AKADEMI KEPERAWATAN POLRI,,
422,AKADEMI KEPERAWATAN PRAGOLOPATI,,
423,AKADEMI KEPERAWATAN PRIMA JAMBI,,
424,AKADEMI KEPERAWATAN PURNA BHAKTI HUSADA,10,
425,AKADEMI KEPERAWATAN PUTRA PERTIWI WATANSOPPENG,,
426,AKADEMI KEPERAWATAN RANTEPAO,,
427,AKADEMI KEPERAWATAN ROYHAN,,
428,AKADEMI KEPERAWATAN RS DGI CIKINI,3,
429,AKADEMI KEPERAWATAN RS DUSTIRA,4,
430,AKADEMI KEPERAWATAN RS EFARINA,,
431,AKADEMI KEPERAWATAN RS HUSADA,3,
432,AKADEMI KEPERAWATAN RS MARTHEN INDEY,,
433,AKADEMI KEPERAWATAN RSP TNI-AU JAKARTA,3,
434,AKADEMI KEPERAWATAN RSPAD GATOT SUBROTO,,
435,AKADEMI KEPERAWATAN RSU HISARMA MEDAN,,
436,AKADEMI KEPERAWATAN RUMAH SAKIT JAKARTA,,
437,AKADEMI KEPERAWATAN RUMAH SAKIT TK. II PELAMONIA,9,
438,AKADEMI KEPERAWATAN RUMKIT TINGKAT III MANADO,16,
439,AKADEMI KEPERAWATAN RUMKIT TK. III DR. J.A. LATUMETEN KESDAM XVI/PATTIMURA,,
440,AKADEMI KEPERAWATAN SAIFUDDIN ZUHRI,4,
441,AKADEMI KEPERAWATAN SAMAWA,8,
442,AKADEMI KEPERAWATAN SANDI KARSA,,
443,AKADEMI KEPERAWATAN SAWERIGADING PEMDA LUWU,9,
444,AKADEMI KEPERAWATAN SEHAT BINJAI,,
445,AKADEMI KEPERAWATAN SETIH SETIO,,
446,AKADEMI KEPERAWATAN SRI BUNGA TANJUNG,,
447,AKADEMI KEPERAWATAN ST. ELISABETH LELA,,
448,AKADEMI KEPERAWATAN SUMBER WARAS,,
449,AKADEMI KEPERAWATAN SURYA NUSANTARA,,
450,AKADEMI KEPERAWATAN SYEKH YUSUF GOWA,,
451,AKADEMI KEPERAWATAN TENAGA PEMBANGUNAN ARJUNA,1,
452,AKADEMI KEPERAWATAN TEUNGKU FAKINAH BANDA ACEH,13,
453,AKADEMI KEPERAWATAN TOTABUAN KOTAMOBAGU,,
454,AKADEMI KEPERAWATAN WIDYA HUSADA,,
455,AKADEMI KEPERAWATAN WIRAHUSADA MEDAN,,
456,AKADEMI KEPERAWATAN YAKPERMAS BANYUMAS,6,
457,AKADEMI KEPERAWATAN YAPI,,
458,AKADEMI KEPERAWATAN YAPPI SRAGEN,,
459,AKADEMI KEPERAWATAN YAPPKES,,
460,AKADEMI KEPERAWATAN YASPEN JAKARTA,,
461,AKADEMI KEPERAWATAN YATNA YUANA LEBAK,,
462,AKADEMI KEPERAWATAN YAYASAN JALAN KIMIA,,
463,AKADEMI KEPERAWATAN YKY YOGYAKARTA,,
464,AKADEMI KEPERAWATAN YPDR,,
465,AKADEMI KEPERAWATAN YPIB MAJALENGKA,4,
466,AKADEMI KEPERAWATAN YPPP WONOMULYO,,
467,AKADEMI KEPERAWATAN YPSBR MUARA BULIAN,10,
468,AKADEMI KEPERAWATAN YPTK SOLOK,10,
469,Akademi Kepolisian (AKPOL),,
470,AKADEMI KESEHATAN ARGA HUSADA,,
471,AKADEMI KESEHATAN ASIH HUSADA,6,
472,AKADEMI KESEHATAN BINTANG PERSADA,,
473,AKADEMI KESEHATAN DINAS PENDIDIKAN DAN KEBUDAYAAN PROVINSI RIAU,,
474,AKADEMI KESEHATAN GIGI DITKESAD JAKARTA,3,
475,AKADEMI KESEHATAN GIGI KARYA ADI HUSADA MATARAM,8,
476,AKADEMI KESEHATAN GIGI KENDARI,9,
477,AKADEMI KESEHATAN JOHN PAUL II PEKANBARU,,
478,AKADEMI KESEHATAN KARYA HUSADA YOGYAKARTA,,
479,AKADEMI KESEHATAN LINGKUNGAN MANDALA WALUYA,,
480,AKADEMI KESEHATAN LINGKUNGAN MUHAMMADIYAH MAKASSAR,,
481,AKADEMI KESEHATAN LINGKUNGAN PEMERINTAH PROVINSI SUMATERA SELATAN,,
482,AKADEMI KESEHATAN RUSTIDA,7,
483,AKADEMI KESEHATAN RUSTIDA,,
484,AKADEMI KESEHATAN SWAKARSA JAKARTA,,
485,AKADEMI KESEHATAN YAYASAN RUMAH SAKIT JAKARTA,3,
486,AKADEMI KESEHATAN YAYASAN SAPTA BAKTI BENGKULU,2,
487,AKADEMI KESEHATAN YAYASAN SAPTA BAKTI BENGKULU,,
488,Akademi Kesejahteraan Sosial AKK,5,
489,Akademi Kesejahteraan Sosial Ibu Kartini,6,
490,Akademi Kesenian Melayu Riau,10,
491,Akademi Ketatalaksanaan Pelayaran Niaga Bahtera,5,
492,Akademi Keuangan Dan Perbankan Borobudur,3,
493,Akademi Keuangan Dan Perbankan Denpasar,8,
494,Akademi Keuangan Dan Perbankan Effata Kupang,15,
495,Akademi Keuangan Dan Perbankan Grha Arta Katulistiwa,11,
496,Akademi Keuangan Dan Perbankan Mulia Darma Pratama,2,
497,Akademi Keuangan Dan Perbankan Padang,10,
498,Akademi Keuangan Perbankan Nusantara,13,
499,Akademi Keuangan Perbankan Tahuna,16,
500,Akademi Komunikasi Indonesia YPK,5,
501,Akademi Komunikasi Media Radio Dan Televisi (AKAMRTV) Jakarta,3,
502,Akademi Komunikasi Radya Binatama,5,
503,Akademi Komunikasi SAE Indonesia,3,
504,Akademi Komunitas Dharma Bhakti Bangka,2,
505,Akademi Komunitas Industri Manufaktur Bantaeng,,
506,Akademi Komunitas Industri Pertambangan Bukit Asam,2,
507,Akademi Komunitas Industri Tekstil Dan Produk Tekstil Surakarta,,
508,Akademi Komunitas Manajemen Perhotelan Indonesia,8,
509,Akademi Komunitas Negeri Aceh Barat,,
510,Akademi Komunitas Negeri Pacitan,,
511,Akademi Komunitas Negeri Putra Sang Fajar Blitar,,
512,Akademi Komunitas Negeri Rejang Lebong,,
513,Akademi Komunitas Olat Maras,8,
514,Akademi Komunitas Perkebunan Yogyakarta,5,
515,Akademi Komunitas Semen Indonesia,7,
516,Akademi Komunitas Semen Indonesia Rembang,6,
517,Akademi Komunitas Toyota Indonesia,4,
518,Akademi Kuliner Dan Patiseri Ottimmo Internasional,7,
519,Akademi Kuliner Monas Pasifik,7,
520,Akademi Manajemen Administrasi (AMA) Yogyakarta,5,
521,Akademi Manajemen Administrasi Dharmala,5,
522,Akademi Manajemen Administrasi Yogyakarta,5,
523,Akademi Manajemen Administrasi YPK Yogyakarta,5,
524,Akademi Manajemen Belitung,2,
525,Akademi Manajemen Bumi Sebalo Bengkayang,11,
526,Akademi Manajemen Informatika &amp; Komputer Jaya Nusa,10,
527,Akademi Manajemen Informatika &amp; Komputer Universal,1,
528,Akademi Manajemen Informatika Dan Komputer Al-Muslim,4,
529,Akademi Manajemen Informatika Dan Komputer Bogor,4,
530,Akademi Manajemen Informatika Dan Komputer BSI Jakarta,3,
531,Akademi Manajemen Informatika Dan Komputer BSI Karawang,4,
532,Akademi Manajemen Informatika Dan Komputer BSI Pontianak,11,
533,Akademi Manajemen Informatika Dan Komputer Cipta Darma,6,
534,Akademi Manajemen Informatika Dan Komputer Dumai,10,
535,Akademi Manajemen Informatika Dan Komputer Garut,4,
536,Akademi Manajemen Informatika Dan Komputer Hass,4,
537,Akademi Manajemen Informatika Dan Komputer Imelda,1,
538,Akademi Manajemen Informatika Dan Komputer Jakarta Teknologi Cipta,6,
539,Akademi Manajemen Informatika Dan Komputer Kosgoro,10,
540,Akademi Manajemen Informatika Dan Komputer Lamappapoleonro Soppeng,9,
541,Akademi Manajemen Informatika Dan Komputer Lampung,2,
542,Akademi Manajemen Informatika Dan Komputer Luwuk Banggai,16,
543,Akademi Manajemen Informatika Dan Komputer Mdp,2,
544,Akademi Manajemen Informatika Dan Komputer Medan Business Polytechnic,1,
545,Akademi Manajemen Informatika Dan Komputer New Media,8,
546,Akademi Manajemen Informatika Dan Komputer PGRI Kebumen,6,
547,Akademi Manajemen Informatika Dan Komputer Raharja Informatika,4,
548,Akademi Manajemen Informatika Dan Komputer Royal,1,
549,Akademi Manajemen Informatika Dan Komputer Selat Panjang,10,
550,Akademi Manajemen Informatika Dan Komputer Serang,4,
551,Akademi Manajemen Informatika Dan Komputer Sigma,2,
552,Akademi Manajemen Informatika Dan Komputer Stiekom Sumatera Utara,1,
553,Akademi Manajemen Informatika Dan Komputer Taruna,7,
554,Akademi Manajemen Informatika Dan Komputer Veteran Purwokerto,6,
555,Akademi Manajemen Informatika Dan Komputer Yapenas Kendari,9,
556,Akademi Manajemen Informatika Dan Komputer YMI Tegal,6,
557,Akademi Manajemen Informatika Dan Komputer YPAT,4,
558,Akademi Manajemen Keuangan BSI Jakarta,3,
559,Akademi Manajemen Komputer Dan Informatika Ketapang,11,
560,Akademi Manajemen Koperasi Tantular,7,
561,Akademi Manajemen Perusahaan Panca Bhakti,11,
562,Akademi Manajemen Putra Jaya,5,
563,Akademi Maritim Aceh Darussalam,13,
564,Akademi Maritim Belawan,1,
565,Akademi Maritim Bina Bahari,2,
566,Akademi Maritim Cirebon,4,
567,Akademi Maritim Djadajat,3,
568,Akademi Maritim Indonesia AIPI,9,
569,Akademi Maritim Indonesia Medan,1,
570,Akademi Maritim Nasional Jaya,3,
571,Akademi Maritim Nusantara Banjarmasin,11,
572,Akademi Maritim Nusantara Cilacap,6,
573,Akademi Maritim Pembangunan Jakarta,3,
574,Akademi Maritim Sapta Samudra,10,
575,Akademi Maritim Suaka Bahari,4,
576,Akademi Maritim Yogyakarta,5,
577,Akademi Metrologi Dan Instrumentasi,,
578,Akademi Militer Magelang,,
579,Akademi Minyak Dan Gas Balongan,4,
580,Akademi Olahraga Prestasi Nasional,3,
581,Akademi Pariwisata 45 Jayapura,14,
582,Akademi Pariwisata BSI Bandung,4,
583,Akademi Pariwisata Buana Wisata Yogyakarta,5,
584,Akademi Pariwisata Bunda Mulia,3,
585,Akademi Pariwisata Bunda Padang,10,
586,Akademi Pariwisata Citra Buana Indonesia,4,
