No,Nama,LLDikti,
2209,Sekolah Tinggi Ilmu Ekonomi YBPK Palangka Raya,11,
2210,Sekolah Tinggi Ilmu Ekonomi Ykp,5,
2211,Sekolah Tinggi Ilmu Ekonomi YKP,5,
2212,Sekolah Tinggi Ilmu Ekonomi YKPN,5,
2213,Sekolah Tinggi Ilmu Ekonomi YPBI,3,
2214,Sekolah Tinggi Ilmu Ekonomi YPHB,13,
2215,Sekolah Tinggi Ilmu Ekonomi YPN,4,
2216,Sekolah Tinggi Ilmu Ekonomi YPPI,6,
2217,Sekolah Tinggi Ilmu Ekonomi YPUP Makassar,9,
2218,SEKOLAH TINGGI ILMU FARMASI BHAKTI PERTIWI,2,
2219,SEKOLAH TINGGI ILMU FARMASI BHAKTI PERTIWI,,
2220,SEKOLAH TINGGI ILMU FARMASI MAKASSAR,,
2221,SEKOLAH TINGGI ILMU FARMASI PADANG,,
2222,SEKOLAH TINGGI ILMU FARMASI PELITA MAS PALU,,
2223,SEKOLAH TINGGI ILMU FARMASI RIAU,,
2224,SEKOLAH TINGGI ILMU FARMASI YAYASAN PHARMASI,6,
2225,SEKOLAH TINGGI ILMU FARMASI YAYASAN PHARMASI,,
2226,Sekolah Tinggi Ilmu Fiqih Syeikh Nawawi Tanara Banten,,
2227,Sekolah Tinggi Ilmu Hukum Al-Banna,13,
2228,Sekolah Tinggi Ilmu Hukum Amsir,9,
2229,Sekolah Tinggi Ilmu Hukum Awang Long,11,
2230,Sekolah Tinggi Ilmu Hukum Biak-Papua,14,
2231,Sekolah Tinggi Ilmu Hukum Bintuni,14,
2232,Sekolah Tinggi Ilmu Hukum Cokroaminoto,9,
2233,Sekolah Tinggi Ilmu Hukum Damarica Palopo,9,
2234,Sekolah Tinggi Ilmu Hukum Dan HAM,16,
2235,Sekolah Tinggi Ilmu Hukum Dan Politik Pelopor Bangsa,4,
2236,Sekolah Tinggi Ilmu Hukum Deli Sumatera,1,
2237,Sekolah Tinggi Ilmu Hukum Dharma Andhiga,4,
2238,Sekolah Tinggi Ilmu Hukum Graha Kirana,1,
2239,Sekolah Tinggi Ilmu Hukum Gunung Jati,4,
2240,Sekolah Tinggi Ilmu Hukum Habaring Hurung Sampit,11,
2241,Sekolah Tinggi Ilmu Hukum IBLAM,3,
2242,Sekolah Tinggi Ilmu Hukum Jenderal Sudirman,7,
2243,Sekolah Tinggi Ilmu Hukum Kebangsaan Bireuen,13,
2244,Sekolah Tinggi Ilmu Hukum Lamaddukelleng,9,
2245,Sekolah Tinggi Ilmu Hukum Lubuk Sikaping,10,
2246,Sekolah Tinggi Ilmu Hukum Manokwari,14,
2247,Sekolah Tinggi Ilmu Hukum Muhammad Thaha Tual,12,
2248,Sekolah Tinggi Ilmu Hukum Muhammadiyah Bima,8,
2249,Sekolah Tinggi Ilmu Hukum Muhammadiyah Kalianda,2,
2250,Sekolah Tinggi Ilmu Hukum Muhammadiyah Takengon,13,
2251,Sekolah Tinggi Ilmu Hukum Nias Selatan,1,
2252,Sekolah Tinggi Ilmu Hukum Padang,10,
2253,Sekolah Tinggi Ilmu Hukum Painan,4,
2254,Sekolah Tinggi Ilmu Hukum Pengayoman,9,
2255,Sekolah Tinggi Ilmu Hukum Persada Bunda,10,
2256,Sekolah Tinggi Ilmu Hukum Pertiba Pangkalpinang,2,
2257,Sekolah Tinggi Ilmu Hukum Prof. Dr. Yohanes Usfunan,,
2258,Sekolah Tinggi Ilmu Hukum Rahmaniyah,2,
2259,Sekolah Tinggi Ilmu Hukum Riau,10,
2260,Sekolah Tinggi Ilmu Hukum Serasan Muara Enim,2,
2261,Sekolah Tinggi Ilmu Hukum Soelthan M Tsjafioeddin,11,
2262,Sekolah Tinggi Ilmu Hukum Sultan Adam,11,
2263,Sekolah Tinggi Ilmu Hukum Sumpah Pemuda,2,
2264,Sekolah Tinggi Ilmu Hukum Swadaya,1,
2265,Sekolah Tinggi Ilmu Hukum Umel Mandiri,14,
2266,Sekolah Tinggi Ilmu Hukum Zainul Hasan,7,
2267,Sekolah Tinggi Ilmu Islam Dan Bahasa Arab (STIBA) Makassar,,
2268,Sekolah Tinggi Ilmu Kehutanan Pante Kulu,13,
2269,SEKOLAH TINGGI ILMU KEPERAWATAN GUNUNG SARI MAKASSAR,9,
2270,SEKOLAH TINGGI ILMU KEPERAWATAN GUNUNG SARI MAKASSAR,,
2271,SEKOLAH TINGGI ILMU KEPERAWATAN MUHAMMADIYAH PONTIANAK,,
2272,SEKOLAH TINGGI ILMU KEPERAWATAN PPNI JAWA BARAT,,
2273,Sekolah Tinggi Ilmu Kepolisian,,
2274,SEKOLAH TINGGI ILMU KESEHATAN  AWAL BROS PEKANBARU,,
2275,SEKOLAH TINGGI ILMU KESEHATAN ABDI NUSA PANGKALPINANG,,
2276,SEKOLAH TINGGI ILMU KESEHATAN ABDI NUSANTARA,3,
2277,SEKOLAH TINGGI ILMU KESEHATAN ABDI NUSANTARA,,
2278,SEKOLAH TINGGI ILMU KESEHATAN ABDURAHMAN PALEMBANG,2,
2279,SEKOLAH TINGGI ILMU KESEHATAN ACHMAD YANI,,
2280,SEKOLAH TINGGI ILMU KESEHATAN ACHMAD YANI YOGYA,5,
2281,SEKOLAH TINGGI ILMU KESEHATAN ADILA,,
2282,SEKOLAH TINGGI ILMU KESEHATAN ADVAITA MEDIKA TABANAN,8,
2283,SEKOLAH TINGGI ILMU KESEHATAN AHMAD DAHLAN CIREBON,,
2284,SEKOLAH TINGGI ILMU KESEHATAN AISYAH PRINGSEWU,2,
2285,SEKOLAH TINGGI ILMU KESEHATAN AISYIYAH BANDUNG,4,
2286,SEKOLAH TINGGI ILMU KESEHATAN AISYIYAH PALEMBANG,,
2287,SEKOLAH TINGGI ILMU KESEHATAN AISYIYAH SURAKARTA,,
2288,SEKOLAH TINGGI ILMU KESEHATAN AKBIDYO,,
2289,SEKOLAH TINGGI ILMU KESEHATAN AL - MA' ARIF BATURAJA,,
2290,SEKOLAH TINGGI ILMU KESEHATAN AL - MA'ARIF BATURAJA,,
2291,SEKOLAH TINGGI ILMU KESEHATAN AL IRSYAD AL ISLAMIYYAH CILACAP,6,
2292,SEKOLAH TINGGI ILMU KESEHATAN AL IRSYAD AL ISLAMIYYAH CILACAP,,
2293,SEKOLAH TINGGI ILMU KESEHATAN ALIFAH PADANG,,
2294,SEKOLAH TINGGI ILMU KESEHATAN AL-INSYIRAH PEKANBARU,10,
2295,SEKOLAH TINGGI ILMU KESEHATAN AL-INSYIRAH PEKANBARU,,
2296,SEKOLAH TINGGI ILMU KESEHATAN AL-IRSYAD AL-ISLAMIYYAH CILACAP,,
2297,SEKOLAH TINGGI ILMU KESEHATAN AL-ISLAM YOGYAKARTA,,
2298,SEKOLAH TINGGI ILMU KESEHATAN AL-SU'AIBAH,,
2299,SEKOLAH TINGGI ILMU KESEHATAN AMANAH MAKASSAR,,
2300,SEKOLAH TINGGI ILMU KESEHATAN AN NASHER CIREBON,,
2301,SEKOLAH TINGGI ILMU KESEHATAN AN-NUR PURWODADI,6,
2302,SEKOLAH TINGGI ILMU KESEHATAN ARJUNA,1,
2303,SEKOLAH TINGGI ILMU KESEHATAN AR-RUM,,
2304,SEKOLAH TINGGI ILMU KESEHATAN ARTA KABANJAHE,,
2305,SEKOLAH TINGGI ILMU KESEHATAN ARTHA BODHI ISWARA,7,
2306,SEKOLAH TINGGI ILMU KESEHATAN ARTHA BODHI ISWARA,,
2307,SEKOLAH TINGGI ILMU KESEHATAN AUFA ROYHAN,1,
2308,SEKOLAH TINGGI ILMU KESEHATAN AUFA ROYHAN,,
2309,SEKOLAH TINGGI ILMU KESEHATAN AUFA ROYHAN,,
2310,SEKOLAH TINGGI ILMU KESEHATAN AVICENNA,9,
2311,SEKOLAH TINGGI ILMU KESEHATAN AVICENNA,,
2312,SEKOLAH TINGGI ILMU KESEHATAN AWAL BROS BATAM,10,
2313,SEKOLAH TINGGI ILMU KESEHATAN AWAL BROS BATAM,,
2314,SEKOLAH TINGGI ILMU KESEHATAN AWAL BROS PEKANBARU,,
2315,SEKOLAH TINGGI ILMU KESEHATAN BAHRUL ULUM JOMBANG,,
2316,SEKOLAH TINGGI ILMU KESEHATAN BAITURRAHIM,,
2317,SEKOLAH TINGGI ILMU KESEHATAN BAITURRAHIM JAMBI,10,
2318,SEKOLAH TINGGI ILMU KESEHATAN BAITURRAHIM JAMBI,,
2319,SEKOLAH TINGGI ILMU KESEHATAN BAKTI NUSANTARA GORONTALO,,
2320,SEKOLAH TINGGI ILMU KESEHATAN BAKTI TUNAS HUSADA,4,
2321,SEKOLAH TINGGI ILMU KESEHATAN BAKTI TUNAS HUSADA TASIKMALAYA,,
2322,SEKOLAH TINGGI ILMU KESEHATAN BAKTI UTAMA PATI,,
2323,SEKOLAH TINGGI ILMU KESEHATAN BALI,,
2324,SEKOLAH TINGGI ILMU KESEHATAN BALI WISNU DHARMA DENPASAR,8,
2325,SEKOLAH TINGGI ILMU KESEHATAN BANI SALEH,,
2326,SEKOLAH TINGGI ILMU KESEHATAN BANTEN,4,
2327,SEKOLAH TINGGI ILMU KESEHATAN BANTEN,,
2328,SEKOLAH TINGGI ILMU KESEHATAN BANYUWANGI,7,
2329,SEKOLAH TINGGI ILMU KESEHATAN BANYUWANGI,,
2330,SEKOLAH TINGGI ILMU KESEHATAN BARAMULI,,
2331,SEKOLAH TINGGI ILMU KESEHATAN BATARAGURU SOROAKA,9,
2332,SEKOLAH TINGGI ILMU KESEHATAN BATARAGURU SOROAKA,,
2333,SEKOLAH TINGGI ILMU KESEHATAN BETHESDA YAKKUM,,
2334,SEKOLAH TINGGI ILMU KESEHATAN BHAKTI AL-QODIRI,,
2335,SEKOLAH TINGGI ILMU KESEHATAN BHAKTI HUSADA BENGKULU,,
2336,SEKOLAH TINGGI ILMU KESEHATAN BHAKTI HUSADA MULIA,7,
2337,SEKOLAH TINGGI ILMU KESEHATAN BHAKTI HUSADA MULIA,,
2338,SEKOLAH TINGGI ILMU KESEHATAN BHAKTI HUSADA MULIA MADIUN,,
2339,SEKOLAH TINGGI ILMU KESEHATAN BHAKTI KENCANA BANDUNG,4,
2340,SEKOLAH TINGGI ILMU KESEHATAN BHAKTI KENCANA BANDUNG,,
2341,SEKOLAH TINGGI ILMU KESEHATAN BHAKTI MANDALA HUSADA,,
2342,SEKOLAH TINGGI ILMU KESEHATAN BHAKTI MANDALA HUSADA SLAWI,,
2343,SEKOLAH TINGGI ILMU KESEHATAN BHAKTI MULIA,7,
2344,SEKOLAH TINGGI ILMU KESEHATAN BHAKTI PERTIWI INDONESIA,,
2345,SEKOLAH TINGGI ILMU KESEHATAN BHAKTI PERTIWI INDONESIA,,
2346,SEKOLAH TINGGI ILMU KESEHATAN BHAKTI PERTIWI LUWU RAYA,9,
2347,SEKOLAH TINGGI ILMU KESEHATAN BHAKTI PERTIWI LUWU RAYA,,
2348,SEKOLAH TINGGI ILMU KESEHATAN BHAKTI PERTIWI LUWU RAYA,,
2349,SEKOLAH TINGGI ILMU KESEHATAN BINA BANGSA MAJENE,,
2350,SEKOLAH TINGGI ILMU KESEHATAN BINA GENERASI POLEWALI MANDAR,,
2351,SEKOLAH TINGGI ILMU KESEHATAN BINA HUSADA,2,
2352,SEKOLAH TINGGI ILMU KESEHATAN BINA HUSADA,,
2353,SEKOLAH TINGGI ILMU KESEHATAN BINA MANDIRI GORONTALO,,
2354,SEKOLAH TINGGI ILMU KESEHATAN BINA PERMATA MEDIKA,,
2355,SEKOLAH TINGGI ILMU KESEHATAN BINA PUTERA BANJAR,,
2356,SEKOLAH TINGGI ILMU KESEHATAN BINA PUTRA BANJAR,,
2357,SEKOLAH TINGGI ILMU KESEHATAN BINA SEHAT PPNI MOJOKERTO,,
2358,SEKOLAH TINGGI ILMU KESEHATAN BINA USADA BALI,,
2359,SEKOLAH TINGGI ILMU KESEHATAN BINALITA SUDAMA,,
2360,Sekolah Tinggi Ilmu Kesehatan Binalita Sudama,1,
2361,SEKOLAH TINGGI ILMU KESEHATAN BINALITA SUDAMA MEDAN,,
2362,SEKOLAH TINGGI ILMU KESEHATAN BINAWAN,3,
2363,SEKOLAH TINGGI ILMU KESEHATAN BINAWAN,,
2364,Sekolah Tinggi Ilmu Kesehatan Bogor Husada,4,
2365,SEKOLAH TINGGI ILMU KESEHATAN BORNEO CENDEKIA MEDIKA,,
2366,SEKOLAH TINGGI ILMU KESEHATAN BORNEO LESTARI,,
2367,SEKOLAH TINGGI ILMU KESEHATAN BUANA HUSADA PONOROGO,,
2368,SEKOLAH TINGGI ILMU KESEHATAN BUDHI LUHUR CIMAHI,,
2369,SEKOLAH TINGGI ILMU KESEHATAN BUDI KEMULIAAN,,
2370,SEKOLAH TINGGI ILMU KESEHATAN BUDI MULIA,,
2371,SEKOLAH TINGGI ILMU KESEHATAN BULELENG,,
2372,SEKOLAH TINGGI ILMU KESEHATAN BUMI PERSADA,,
2373,SEKOLAH TINGGI ILMU KESEHATAN BUSTANUL ULUM LANGSA,,
2374,SEKOLAH TINGGI ILMU KESEHATAN CAHAYA BANGSA BANJARMASIN,11,
2375,SEKOLAH TINGGI ILMU KESEHATAN CENDEKIA UTAMA KUDUS,,
2376,SEKOLAH TINGGI ILMU KESEHATAN CERIA BUANA,10,
2377,SEKOLAH TINGGI ILMU KESEHATAN CERIA BUANA,,
2378,SEKOLAH TINGGI ILMU KESEHATAN CIREBON,,
2379,SEKOLAH TINGGI ILMU KESEHATAN CITRA DELIMA BANGKA BELITUNG,2,
2380,SEKOLAH TINGGI ILMU KESEHATAN CITRA DELIMA BANGKA BELITUNG,,
2381,SEKOLAH TINGGI ILMU KESEHATAN CITRA HUSADA MANDIRI KUPANG,15,
2382,SEKOLAH TINGGI ILMU KESEHATAN CITRA HUSADA MANDIRI KUPANG,,
2383,SEKOLAH TINGGI ILMU KESEHATAN CUT NYAK DHIEN LANGSA,13,
2384,SEKOLAH TINGGI ILMU KESEHATAN CUT NYAK DHIEN LANGSA,,
2385,SEKOLAH TINGGI ILMU KESEHATAN DARMAIS PADANGSIDIMPUAN,,
2386,SEKOLAH TINGGI ILMU KESEHATAN DARUL AZHAR BATULICIN,,
2387,SEKOLAH TINGGI ILMU KESEHATAN DARUSSALAM LHOKSEUMAWE,,
2388,SEKOLAH TINGGI ILMU KESEHATAN DATU KAMANRE,,
2389,SEKOLAH TINGGI ILMU KESEHATAN DEHASEN,2,
2390,SEKOLAH TINGGI ILMU KESEHATAN DELIMA PERSADA GRESIK,,
2391,SEKOLAH TINGGI ILMU KESEHATAN DHARMA HUSADA,4,
2392,SEKOLAH TINGGI ILMU KESEHATAN DHARMA HUSADA,,
2393,SEKOLAH TINGGI ILMU KESEHATAN DHARMA LANDBOUW,,
2394,SEKOLAH TINGGI ILMU KESEHATAN DIAN HUSADA,,
2395,SEKOLAH TINGGI ILMU KESEHATAN DIRGAHAYU SAMARINDA,,
2396,SEKOLAH TINGGI ILMU KESEHATAN DR. SOEBANDI JEMBER,,
2397,SEKOLAH TINGGI ILMU KESEHATAN DUTA GAMA KLATEN,6,
2398,SEKOLAH TINGGI ILMU KESEHATAN DUTA GAMA KLATEN,,
2399,SEKOLAH TINGGI ILMU KESEHATAN EKA HARAP,11,
2400,SEKOLAH TINGGI ILMU KESEHATAN EKA HARAP,,
2401,SEKOLAH TINGGI ILMU KESEHATAN ELISABETH,,
2402,SEKOLAH TINGGI ILMU KESEHATAN ESTU UTOMO,,
2403,SEKOLAH TINGGI ILMU KESEHATAN FAATHIR HUSADA,,
2404,SEKOLAH TINGGI ILMU KESEHATAN FALETEHAN,4,
2405,SEKOLAH TINGGI ILMU KESEHATAN FITRAH ALDAR LUBUK LINGGAU,,
2406,SEKOLAH TINGGI ILMU KESEHATAN FLORA,1,
2407,SEKOLAH TINGGI ILMU KESEHATAN FLORA,,
2408,SEKOLAH TINGGI ILMU KESEHATAN FLORA MEDAN,1,
2409,SEKOLAH TINGGI ILMU KESEHATAN FLORA MEDAN,,
2410,SEKOLAH TINGGI ILMU KESEHATAN FORT DE KOCK,10,
2411,SEKOLAH TINGGI ILMU KESEHATAN FORT DE KOCK,,
2412,SEKOLAH TINGGI ILMU KESEHATAN FORT DE KOCK BUKITTINGGI,,
2413,SEKOLAH TINGGI ILMU KESEHATAN GANESHA HUSADA KEDIRI,7,
2414,SEKOLAH TINGGI ILMU KESEHATAN GANESHA HUSADA KEDIRI,,
2415,SEKOLAH TINGGI ILMU KESEHATAN GARUDA PUTIH,,
2416,SEKOLAH TINGGI ILMU KESEHATAN GARUT,,
2417,SEKOLAH TINGGI ILMU KESEHATAN GEMA INSAN AKADEMIK MAKASSAR,,
2418,SEKOLAH TINGGI ILMU KESEHATAN GETSEMPENA LHOKSUKON,13,
2419,SEKOLAH TINGGI ILMU KESEHATAN GETSEMPENA LHOKSUKON,,
2420,SEKOLAH TINGGI ILMU KESEHATAN GRAHA EDUKASI,,
2421,SEKOLAH TINGGI ILMU KESEHATAN GRAHA EDUKASI MAKASSAR,,
2422,SEKOLAH TINGGI ILMU KESEHATAN GRAHA MANDIRI CILACAP,,
2423,SEKOLAH TINGGI ILMU KESEHATAN GRAHA MEDIKA,,
2424,SEKOLAH TINGGI ILMU KESEHATAN GRIYA HUSADA SUMBAWA,,
2425,SEKOLAH TINGGI ILMU KESEHATAN GUNA BANGSA YOGYAKARTA,5,
2426,SEKOLAH TINGGI ILMU KESEHATAN GUNA BANGSA YOGYAKARTA,,
2427,SEKOLAH TINGGI ILMU KESEHATAN GUNUNG SARI,,
2428,SEKOLAH TINGGI ILMU KESEHATAN HAFSHAWATY PESANTREN ZAINUL HASAN,7,
2429,SEKOLAH TINGGI ILMU KESEHATAN HAFSHAWATY PESANTREN ZAINUL HASAN,,
2430,SEKOLAH TINGGI ILMU KESEHATAN HAKLI,6,
2431,SEKOLAH TINGGI ILMU KESEHATAN HAKLI,,
2432,SEKOLAH TINGGI ILMU KESEHATAN HALMAHERA,12,
2433,SEKOLAH TINGGI ILMU KESEHATAN HALMAHERA,,
2434,SEKOLAH TINGGI ILMU KESEHATAN HAMZAR MEMBEN LOMBOK TIMUR,8,
2435,SEKOLAH TINGGI ILMU KESEHATAN HAMZAR MEMBEN LOMBOK TIMUR,,
2436,SEKOLAH TINGGI ILMU KESEHATAN HANG TUAH PEKANBARU,10,
2437,SEKOLAH TINGGI ILMU KESEHATAN HANG TUAH PEKANBARU,,
2438,SEKOLAH TINGGI ILMU KESEHATAN HANG TUAH SURABAYA,,
2439,SEKOLAH TINGGI ILMU KESEHATAN HANG TUAH TANJUNG PINANG,10,
2440,SEKOLAH TINGGI ILMU KESEHATAN HARAPAN BANGSA,,
2441,SEKOLAH TINGGI ILMU KESEHATAN HARAPAN BANGSA,,
2442,SEKOLAH TINGGI ILMU KESEHATAN HARAPAN BANGSA,,
2443,SEKOLAH TINGGI ILMU KESEHATAN HARAPAN IBU JAMBI,10,
2444,SEKOLAH TINGGI ILMU KESEHATAN HARAPAN IBU JAMBI,,
2445,SEKOLAH TINGGI ILMU KESEHATAN HOLISTIK,,
2446,SEKOLAH TINGGI ILMU KESEHATAN HUSADA BORNEO,,
2447,SEKOLAH TINGGI ILMU KESEHATAN HUSADA JOMBANG,,
2448,SEKOLAH TINGGI ILMU KESEHATAN HUSADA MANDIRI POSO,,
2449,SEKOLAH TINGGI ILMU KESEHATAN HUTAMA ABDI HUSADA TULUNGAGUNG,7,
2450,SEKOLAH TINGGI ILMU KESEHATAN HUTAMA ABDI HUSADA TULUNGAGUNG,,
2451,SEKOLAH TINGGI ILMU KESEHATAN IBNU SINA AJIBARANG,,
2452,SEKOLAH TINGGI ILMU KESEHATAN IBNU SINA BATAM,10,
2453,SEKOLAH TINGGI ILMU KESEHATAN ICHSAN MEDICAL CENTRE BINTARO,,
2454,SEKOLAH TINGGI ILMU KESEHATAN IKIFA,3,
2455,SEKOLAH TINGGI ILMU KESEHATAN IMMANUEL,,
2456,SEKOLAH TINGGI ILMU KESEHATAN IMMANUEL BANDUNG,,
2457,SEKOLAH TINGGI ILMU KESEHATAN INDAH MEDAN,1,
2458,SEKOLAH TINGGI ILMU KESEHATAN INDAH MEDAN,,
2459,SEKOLAH TINGGI ILMU KESEHATAN INDONESIA JAYA,16,
2460,SEKOLAH TINGGI ILMU KESEHATAN INDONESIA JAYA,,
2461,SEKOLAH TINGGI ILMU KESEHATAN INDONESIA MAJU,3,
2462,Sekolah Tinggi Ilmu Kesehatan Indonesia Maju,3,
2463,SEKOLAH TINGGI ILMU KESEHATAN INDONESIA MAJU,,
2464,SEKOLAH TINGGI ILMU KESEHATAN INDONESIA PADANG,10,
2465,Sekolah Tinggi Ilmu Kesehatan Indonesia Padang,10,
2466,SEKOLAH TINGGI ILMU KESEHATAN INDONESIA PADANG,,
2467,SEKOLAH TINGGI ILMU KESEHATAN INDRAMAYU,,
2468,SEKOLAH TINGGI ILMU KESEHATAN INSAN CENDEKIA HUSADA BOJONEGORO,,
2469,SEKOLAH TINGGI ILMU KESEHATAN INSAN CENDEKIA MEDIKA,,
2470,SEKOLAH TINGGI ILMU KESEHATAN INSAN UNGGUL,7,
2471,SEKOLAH TINGGI ILMU KESEHATAN INSAN UNGGUL SURABAYA,7,
2472,SEKOLAH TINGGI ILMU KESEHATAN INTAN MARTAPURA,,
2473,SEKOLAH TINGGI ILMU KESEHATAN ISFI BANJARMASIN,,
2474,SEKOLAH TINGGI ILMU KESEHATAN IST BUTON,,
2475,SEKOLAH TINGGI ILMU KESEHATAN ISTARA NUSANTARA,3,
2476,SEKOLAH TINGGI ILMU KESEHATAN ISTARA NUSANTARA,,
2477,SEKOLAH TINGGI ILMU KESEHATAN ISTARA NUSANTARA,,
2478,SEKOLAH TINGGI ILMU KESEHATAN JAYAKARTA,,
2479,SEKOLAH TINGGI ILMU KESEHATAN JAYAPURA,,
2480,SEKOLAH TINGGI ILMU KESEHATAN JENDERAL ACHMAD YANI,4,
2481,SEKOLAH TINGGI ILMU KESEHATAN JENDERAL ACHMAD YANI,,
2482,SEKOLAH TINGGI ILMU KESEHATAN JENDERAL AHMAD YANI,,
2483,SEKOLAH TINGGI ILMU KESEHATAN KAPUAS RAYA,11,
2484,SEKOLAH TINGGI ILMU KESEHATAN KAPUAS RAYA SINTANG,,
2485,SEKOLAH TINGGI ILMU KESEHATAN KARIMUN,10,
2486,SEKOLAH TINGGI ILMU KESEHATAN KARIMUN,,
2487,SEKOLAH TINGGI ILMU KESEHATAN KARSA HUSADA,,
2488,SEKOLAH TINGGI ILMU KESEHATAN KARSA HUSADA GARUT,,
2489,SEKOLAH TINGGI ILMU KESEHATAN KARYA HUSADA KEDIRI,7,
2490,SEKOLAH TINGGI ILMU KESEHATAN KARYA HUSADA KEDIRI,,
2491,SEKOLAH TINGGI ILMU KESEHATAN KARYA HUSADA SEMARANG,,
2492,SEKOLAH TINGGI ILMU KESEHATAN KARYA KESEHATAN,,
2493,SEKOLAH TINGGI ILMU KESEHATAN KARYA PUTRA BANGSA,,
2494,SEKOLAH TINGGI ILMU KESEHATAN KATOLIK ST. VINCENTIUS A PAULO,7,
2495,SEKOLAH TINGGI ILMU KESEHATAN KATOLIK ST. VINCENTIUS A PAULO,,
2496,SEKOLAH TINGGI ILMU KESEHATAN KELUARGA BUNDA JAMBI,10,
2497,SEKOLAH TINGGI ILMU KESEHATAN KENDAL,6,
2498,SEKOLAH TINGGI ILMU KESEHATAN KENDAL,,
2499,SEKOLAH TINGGI ILMU KESEHATAN KENDEDES,7,
2500,SEKOLAH TINGGI ILMU KESEHATAN KENDEDES,,
2501,SEKOLAH TINGGI ILMU KESEHATAN KEPANJEN,7,
2502,SEKOLAH TINGGI ILMU KESEHATAN KEPANJEN,,
2503,SEKOLAH TINGGI ILMU KESEHATAN KESDAM IV / DIPONEGORO,6,
2504,SEKOLAH TINGGI ILMU KESEHATAN KESDAM IX/UDAYANA,8,
2505,SEKOLAH TINGGI ILMU KESEHATAN KESEHATAN BARU,,
2506,SEKOLAH TINGGI ILMU KESEHATAN KESETIAKAWANAN SOSIAL INDONESIA,3,
2507,SEKOLAH TINGGI ILMU KESEHATAN KESETIAKAWANAN SOSIAL INDONESIA,,
2508,SEKOLAH TINGGI ILMU KESEHATAN KHARISMA KARAWANG,4,
2509,SEKOLAH TINGGI ILMU KESEHATAN KHARISMA KARAWANG,,
2510,SEKOLAH TINGGI ILMU KESEHATAN KHARISMA PERSADA,,
2511,SEKOLAH TINGGI ILMU KESEHATAN KHARISMA PERSADA,,
2512,SEKOLAH TINGGI ILMU KESEHATAN KUNINGAN,,
2513,SEKOLAH TINGGI ILMU KESEHATAN KUNINGAN GARAWANGI,,
2514,SEKOLAH TINGGI ILMU KESEHATAN LAKIPADADA,,
2515,SEKOLAH TINGGI ILMU KESEHATAN LANGSA,,
2516,SEKOLAH TINGGI ILMU KESEHATAN MADANI YOGYAKARTA,5,
2517,SEKOLAH TINGGI ILMU KESEHATAN MADANI YOGYAKARTA,,
2518,SEKOLAH TINGGI ILMU KESEHATAN MAHARANI,,
2519,SEKOLAH TINGGI ILMU KESEHATAN MAHARDIKA CIREBON,4,
2520,SEKOLAH TINGGI ILMU KESEHATAN MAHARDIKA CIREBON,,
2521,SEKOLAH TINGGI ILMU KESEHATAN MAJAPAHIT,,
2522,SEKOLAH TINGGI ILMU KESEHATAN MAKASSAR,,
2523,SEKOLAH TINGGI ILMU KESEHATAN MALUKU HUSADA,12,
2524,SEKOLAH TINGGI ILMU KESEHATAN MALUKU HUSADA,,
2525,SEKOLAH TINGGI ILMU KESEHATAN MANDALA WALUYA KENDARI,,
2526,SEKOLAH TINGGI ILMU KESEHATAN MARANATHA KUPANG,,
2527,SEKOLAH TINGGI ILMU KESEHATAN MARENDENG MAJENE,9,
2528,SEKOLAH TINGGI ILMU KESEHATAN MARENDENG MAJENE,,
2529,SEKOLAH TINGGI ILMU KESEHATAN MASYARAKAT ABDI NUSA,,
2530,SEKOLAH TINGGI ILMU KESEHATAN MASYARAKAT NUSANTARA,2,
2531,SEKOLAH TINGGI ILMU KESEHATAN MATARAM,,
2532,SEKOLAH TINGGI ILMU KESEHATAN MEDIKA,,
2533,SEKOLAH TINGGI ILMU KESEHATAN MEDIKA NURUL ISLAM,13,
2534,SEKOLAH TINGGI ILMU KESEHATAN MEDIKA NURUL ISLAM,,
2535,SEKOLAH TINGGI ILMU KESEHATAN MEDIKA SERAMOE BARAT,,
2536,SEKOLAH TINGGI ILMU KESEHATAN MEDIKA TEUKU UMAR,,
2537,SEKOLAH TINGGI ILMU KESEHATAN MEDISTRA,1,
2538,SEKOLAH TINGGI ILMU KESEHATAN MEDISTRA INDONESIA,3,
2539,SEKOLAH TINGGI ILMU KESEHATAN MEDISTRA INDONESIA,,
2540,SEKOLAH TINGGI ILMU KESEHATAN MEGA BUANA PALOPO,9,
2541,SEKOLAH TINGGI ILMU KESEHATAN MEGA BUANA PALOPO,,
2542,SEKOLAH TINGGI ILMU KESEHATAN MEGA REZKY,9,
2543,SEKOLAH TINGGI ILMU KESEHATAN MEGA REZKY MAKASSAR,,
2544,SEKOLAH TINGGI ILMU KESEHATAN MERANGIN,,
2545,SEKOLAH TINGGI ILMU KESEHATAN MERCUBAKTIJAYA PADANG,,
2546,SEKOLAH TINGGI ILMU KESEHATAN MITRA ADIGUNA,2,
2547,SEKOLAH TINGGI ILMU KESEHATAN MITRA ADIGUNA,,
2548,SEKOLAH TINGGI ILMU KESEHATAN MITRA BUNDA PERSADA,10,
2549,SEKOLAH TINGGI ILMU KESEHATAN MITRA BUNDA PERSADA,,
2550,SEKOLAH TINGGI ILMU KESEHATAN MITRA BUNDA PERSADA BATAM,10,
2551,SEKOLAH TINGGI ILMU KESEHATAN MITRA BUNDA PERSADA BATAM,,
2552,SEKOLAH TINGGI ILMU KESEHATAN MITRA HUSADA KARANGANYAR,,
2553,SEKOLAH TINGGI ILMU KESEHATAN MITRA HUSADA MEDAN,,
2554,SEKOLAH TINGGI ILMU KESEHATAN MITRA KELUARGA,,
2555,SEKOLAH TINGGI ILMU KESEHATAN MITRA KELUARGA JAKARTA,3,
2556,SEKOLAH TINGGI ILMU KESEHATAN MITRA KENCANA TASIKMALAYA,4,
2557,SEKOLAH TINGGI ILMU KESEHATAN MITRA KENCANA TASIKMALAYA,,
2558,SEKOLAH TINGGI ILMU KESEHATAN MITRA LAMPUNG,,
2559,SEKOLAH TINGGI ILMU KESEHATAN MITRA RIA HUSADA,,
2560,SEKOLAH TINGGI ILMU KESEHATAN MUHAMMADIYAH ACEH,13,
2561,Sekolah Tinggi Ilmu Kesehatan Muhammadiyah Aceh,13,
2562,SEKOLAH TINGGI ILMU KESEHATAN MUHAMMADIYAH BOJONEGORO,,
2563,SEKOLAH TINGGI ILMU KESEHATAN MUHAMMADIYAH CIAMIS,4,
2564,SEKOLAH TINGGI ILMU KESEHATAN MUHAMMADIYAH CIAMIS,,
2565,SEKOLAH TINGGI ILMU KESEHATAN MUHAMMADIYAH CIREBON,,
2566,SEKOLAH TINGGI ILMU KESEHATAN MUHAMMADIYAH GOMBONG,,
2567,SEKOLAH TINGGI ILMU KESEHATAN MUHAMMADIYAH KENDAL,,
2568,SEKOLAH TINGGI ILMU KESEHATAN MUHAMMADIYAH KLATEN,6,
2569,SEKOLAH TINGGI ILMU KESEHATAN MUHAMMADIYAH KLATEN,,
2570,SEKOLAH TINGGI ILMU KESEHATAN MUHAMMADIYAH KUDUS,6,
2571,SEKOLAH TINGGI ILMU KESEHATAN MUHAMMADIYAH LAMONGAN,,
2572,SEKOLAH TINGGI ILMU KESEHATAN MUHAMMADIYAH LHOKSEUMAWE,13,
2573,SEKOLAH TINGGI ILMU KESEHATAN MUHAMMADIYAH LHOKSEUMAWE,,
2574,SEKOLAH TINGGI ILMU KESEHATAN MUHAMMADIYAH MANADO,,
2575,SEKOLAH TINGGI ILMU KESEHATAN MUHAMMADIYAH PALEMBANG,,
2576,SEKOLAH TINGGI ILMU KESEHATAN MUHAMMADIYAH PALEMBANG,,
2577,SEKOLAH TINGGI ILMU KESEHATAN MUHAMMADIYAH PEKAJANGAN,,
2578,SEKOLAH TINGGI ILMU KESEHATAN MUHAMMADIYAH PRINGSEWU,2,
2579,SEKOLAH TINGGI ILMU KESEHATAN MUHAMMADIYAH SAMARINDA,11,
2580,SEKOLAH TINGGI ILMU KESEHATAN MUHAMMADIYAH SIDRAP,9,
2581,SEKOLAH TINGGI ILMU KESEHATAN MUHAMMADIYAH SIDRAP,,
2582,SEKOLAH TINGGI ILMU KESEHATAN MURNI TEGUH,,
2583,SEKOLAH TINGGI ILMU KESEHATAN MUTIARA MAHAKAM SAMARINDA,11,
2584,SEKOLAH TINGGI ILMU KESEHATAN NAHDLATUL ULAMA TUBAN,7,
2585,SEKOLAH TINGGI ILMU KESEHATAN NAN TONGGA,10,
2586,SEKOLAH TINGGI ILMU KESEHATAN NANI HASANUDDIN MAKASSAR,,
2587,SEKOLAH TINGGI ILMU KESEHATAN NASIONAL,,
2588,SEKOLAH TINGGI ILMU KESEHATAN NAULI HUSADA,,
2589,SEKOLAH TINGGI ILMU KESEHATAN NAULI HUSADA SIBOLGA,,
2590,SEKOLAH TINGGI ILMU KESEHATAN NAZHATUT THULLAB SAMPANG,7,
2591,SEKOLAH TINGGI ILMU KESEHATAN NGESTI WALUYO,,
2592,SEKOLAH TINGGI ILMU KESEHATAN NGUDIA HUSADA MADURA,,
2593,SEKOLAH TINGGI ILMU KESEHATAN NOTOKUSUMO YOGYAKARTA,5,
2594,SEKOLAH TINGGI ILMU KESEHATAN NURLIANA MEDAN,,
2595,SEKOLAH TINGGI ILMU KESEHATAN NURUL HASANAH KUTACANE,13,
2596,SEKOLAH TINGGI ILMU KESEHATAN NURUL HASANAH KUTACANE,,
2597,SEKOLAH TINGGI ILMU KESEHATAN NURUL JADID,7,
2598,SEKOLAH TINGGI ILMU KESEHATAN NURUL JADID,,
2599,SEKOLAH TINGGI ILMU KESEHATAN NUSANTARA,15,
2600,SEKOLAH TINGGI ILMU KESEHATAN NUSANTARA,,
2601,SEKOLAH TINGGI ILMU KESEHATAN NUSANTARA JAYA,,
2602,SEKOLAH TINGGI ILMU KESEHATAN PAGUWARMAS MAOS CILACAP,,
2603,SEKOLAH TINGGI ILMU KESEHATAN PAMENANG,,
2604,SEKOLAH TINGGI ILMU KESEHATAN PANAKKUKANG,9,
2605,SEKOLAH TINGGI ILMU KESEHATAN PANAKKUKANG,,
2606,SEKOLAH TINGGI ILMU KESEHATAN PANCA ATMA JAYA,,
2607,SEKOLAH TINGGI ILMU KESEHATAN PANCA BHAKTI,,
2608,SEKOLAH TINGGI ILMU KESEHATAN PANRITA HUSADA BULUKUMBA,9,
2609,SEKOLAH TINGGI ILMU KESEHATAN PANRITA HUSADA BULUKUMBA,,
2610,SEKOLAH TINGGI ILMU KESEHATAN PANTI KOSALA,,
2611,SEKOLAH TINGGI ILMU KESEHATAN PANTI RAPIH,,
2612,SEKOLAH TINGGI ILMU KESEHATAN PANTI RAPIH YOGYAKARTA,,
2613,SEKOLAH TINGGI ILMU KESEHATAN PANTI WALUYA MALANG,,
2614,SEKOLAH TINGGI ILMU KESEHATAN PANTI WILASA,6,
2615,SEKOLAH TINGGI ILMU KESEHATAN PAPUA,14,
2616,SEKOLAH TINGGI ILMU KESEHATAN PAPUA,,
2617,SEKOLAH TINGGI ILMU KESEHATAN PASAPUA AMBON,,
2618,SEKOLAH TINGGI ILMU KESEHATAN PATRIA HUSADA,7,
2619,SEKOLAH TINGGI ILMU KESEHATAN PATRIA HUSADA,,
2620,SEKOLAH TINGGI ILMU KESEHATAN PAYUNG NEGERI,10,
2621,SEKOLAH TINGGI ILMU KESEHATAN PAYUNG NEGERI,,
2622,SEKOLAH TINGGI ILMU KESEHATAN PAYUNG NEGERI ACEH DARUSSALAM,,
2623,SEKOLAH TINGGI ILMU KESEHATAN PEKANBARU MEDICAL CENTER,10,
2624,SEKOLAH TINGGI ILMU KESEHATAN PEKANBARU MEDICAL CENTER,,
2625,SEKOLAH TINGGI ILMU KESEHATAN PELAMONIA KESDAM VII/WIRABUANA,,
2626,SEKOLAH TINGGI ILMU KESEHATAN PEMBINA PALEMBANG,,
2627,SEKOLAH TINGGI ILMU KESEHATAN PEMKAB JOMBANG,,
2628,SEKOLAH TINGGI ILMU KESEHATAN PERINTIS PADANG,,
2629,SEKOLAH TINGGI ILMU KESEHATAN PERSADA HUSADA INDONESIA,3,
2630,SEKOLAH TINGGI ILMU KESEHATAN PERSADA HUSADA INDONESIA,,
2631,SEKOLAH TINGGI ILMU KESEHATAN PERTAMEDIKA,,
2632,SEKOLAH TINGGI ILMU KESEHATAN PIALA SAKTI PARIAMAN,10,
2633,SEKOLAH TINGGI ILMU KESEHATAN PIALA SAKTI PARIAMAN,,
2634,SEKOLAH TINGGI ILMU KESEHATAN PKU MUHAMMADIYAH SURAKARTA,,
2635,SEKOLAH TINGGI ILMU KESEHATAN PRIMA NUSANTARA,10,
2636,SEKOLAH TINGGI ILMU KESEHATAN PRIMA NUSANTARA,,
2637,SEKOLAH TINGGI ILMU KESEHATAN PUANGRIMANGGALATUNG,,
2638,SEKOLAH TINGGI ILMU KESEHATAN PURNA BHAKTI HUSADA BATUSANGKAR,,
2639,SEKOLAH TINGGI ILMU KESEHATAN PUTRA ABADI LANGKAT,1,
2640,SEKOLAH TINGGI ILMU KESEHATAN QAMARUL HUDA,8,
2641,SEKOLAH TINGGI ILMU KESEHATAN RAFLESIA,,
2642,SEKOLAH TINGGI ILMU KESEHATAN RAJAWALI,,
2643,SEKOLAH TINGGI ILMU KESEHATAN RAJEKWESI BOJONEGORO,,
2644,SEKOLAH TINGGI ILMU KESEHATAN RANAH MINANG,10,
2645,SEKOLAH TINGGI ILMU KESEHATAN RANAH MINANG,,
2646,SEKOLAH TINGGI ILMU KESEHATAN RESPATI TASIKMALAYA,4,
2647,SEKOLAH TINGGI ILMU KESEHATAN RESPATI TASIKMALAYA,,
2648,SEKOLAH TINGGI ILMU KESEHATAN RS HAJI MEDAN,1,
2649,SEKOLAH TINGGI ILMU KESEHATAN RS HAJI MEDAN,,
2650,SEKOLAH TINGGI ILMU KESEHATAN RS HUSADA,3,
2651,SEKOLAH TINGGI ILMU KESEHATAN RSPAD GATOT SOEBROTO,,
2652,SEKOLAH TINGGI ILMU KESEHATAN RUMAH SAKIT ANWAR MEDIKA,,
2653,SEKOLAH TINGGI ILMU KESEHATAN SAKINAH HUSADA TANJUNG BALAI,,
2654,SEKOLAH TINGGI ILMU KESEHATAN SALEWANGAN MAROS,9,
2655,SEKOLAH TINGGI ILMU KESEHATAN SALEWANGAN MAROS,,
2656,SEKOLAH TINGGI ILMU KESEHATAN SALSABILA SERANG,,
2657,SEKOLAH TINGGI ILMU KESEHATAN SAMARINDA,,
2658,SEKOLAH TINGGI ILMU KESEHATAN SANTA ELISABETH MEDAN,1,
2659,SEKOLAH TINGGI ILMU KESEHATAN SANTA ELISABETH MEDAN,,
2660,SEKOLAH TINGGI ILMU KESEHATAN SANTO BORROMEUS,4,
2661,SEKOLAH TINGGI ILMU KESEHATAN SANTU PAULUS RUTENG,,
2662,SEKOLAH TINGGI ILMU KESEHATAN SAPTA BAKTI,2,
2663,SEKOLAH TINGGI ILMU KESEHATAN SARI MULIA,11,
2664,SEKOLAH TINGGI ILMU KESEHATAN SARI MULIA,,
2665,SEKOLAH TINGGI ILMU KESEHATAN SATRIA BHAKTI NGANJUK,7,
2666,SEKOLAH TINGGI ILMU KESEHATAN SATRIA BHAKTI NGANJUK,,
2667,SEKOLAH TINGGI ILMU KESEHATAN SEBELAS APRIL SUMEDANG,4,
2668,SEKOLAH TINGGI ILMU KESEHATAN SEBELAS APRIL SUMEDANG,,
2669,SEKOLAH TINGGI ILMU KESEHATAN SEHAT MEDAN,1,
2670,SEKOLAH TINGGI ILMU KESEHATAN SENIOR MEDAN,1,
2671,SEKOLAH TINGGI ILMU KESEHATAN SENIOR MEDAN,,
2672,SEKOLAH TINGGI ILMU KESEHATAN SERULINGMAS,,
2673,SEKOLAH TINGGI ILMU KESEHATAN SINT CAROLUS,3,
2674,SEKOLAH TINGGI ILMU KESEHATAN SISMADI,,
2675,SEKOLAH TINGGI ILMU KESEHATAN SITI HAJAR,1,
2676,SEKOLAH TINGGI ILMU KESEHATAN SITI HAJAR,,
2677,SEKOLAH TINGGI ILMU KESEHATAN SITI KHADIJAH,,
2678,SEKOLAH TINGGI ILMU KESEHATAN ST. FATIMAH,,
2679,SEKOLAH TINGGI ILMU KESEHATAN STELLA MARIS,,
2680,SEKOLAH TINGGI ILMU KESEHATAN SUAKA INSAN,,
2681,SEKOLAH TINGGI ILMU KESEHATAN SUKABUMI,,
2682,SEKOLAH TINGGI ILMU KESEHATAN SUMATERA UTARA,,
2683,SEKOLAH TINGGI ILMU KESEHATAN SURABAYA,7,
2684,SEKOLAH TINGGI ILMU KESEHATAN SURYA GLOBAL,,
2685,SEKOLAH TINGGI ILMU KESEHATAN SURYA MITRA HUSADA KEDIRI,,
2686,SEKOLAH TINGGI ILMU KESEHATAN SYEDZA SAINTIKA,,
2687,SEKOLAH TINGGI ILMU KESEHATAN SYEDZA SAINTIKA PADANG,,
2688,SEKOLAH TINGGI ILMU KESEHATAN SYUHADA PADANGSIDIMPUAN,,
